Party,Chairperson,Percentage,Founding Year
China Zhi Gong Party,Jiang Zuojun,30/544,1925
Chinese Peasants' and Workers' Democratic Party,He Wei,45/544,1930
China Democratic League,Ding Zhongli,65/544,1941
China National Democratic Construction Association,Hao Mingjin,65/544,1945
China Association for Promoting Democracy,Cai Dafeng,45/544,1945
Jiusan Society,Wu Weihua,45/544,1945
Taiwan Democratic Self-Government League,Su Hui,20/544,1947
Revolutionary Committee of the Chinese Kuomintang,Zheng Jianbang,65/544,1948